{
  "type": "world_object",
  "id": "obj.bowl_small",
  "name": "Small bowl",
  "description": "An individual eating bowl for pottage.",
  "category": "household",
  "handling": "pocketable",
  "tags": [
    "kitchen",
    "pottery",
    "tableware"
  ],
  "physical": {
    "mass_kg": 0.25,
    "size_m": [
      0.12,
      0.07,
      0.12
    ],
    "materials": [
      "clay_ceramic"
    ],
    "fragile": true
  },
  "actions": [
    "inspect",
    "take",
    "drop",
    "throw",
    "open"
  ],
  "economy": {
    "base_pfennigs": 3,
    "ownership": "household",
    "legality": "legal",
    "theft_severity": 1
  },
  "placement": {
    "mount": "floor",
    "spaces": [
      "home_poor",
      "home_burgher",
      "tavern"
    ],
    "grouping": "single"
  },
  "model": {
    "status": "glb",
    "glb": "res://assets/props/domestic/kitchenware/medieval_kitchenware_kit.glb",
    "node": "KitchenwareBowlSmall",
    "prop_kind": "kitchenware",
    "variant": "kitchenware.bowl_small",
    "measured_size_m": [
      0.12,
      0.07,
      0.12
    ]
  },
  "visual": {
    "preview": "docs/reports/images/object_catalog/obj.bowl_small.png",
    "icon": "res://assets/objects/icons/obj.bowl_small.png",
    "icon_status": "missing",
    "look": "Small round clay bowl, thin rim, soot-darkened exterior.",
    "image_prompt": "Small bowl: Small round clay bowl, thin rim, soot-darkened exterior."
  },
  "lifecycle": "usable",
  "confidence": "plausible composite",
  "carry": {
    "grid_width": 1,
    "grid_height": 1,
    "stackable": false
  },
  "throw": {
    "range_m": 3.5,
    "damage": 1,
    "breaks": true,
    "noise": "loud"
  },
  "container": {
    "capacity_l": 0.4,
    "lockable": false,
    "accepts_tags": [
      "food",
      "liquid"
    ]
  }
}
