{
  "type": "world_object",
  "id": "obj.salt_pile",
  "name": "Salt pile",
  "description": "A heap of coarse salt with a scoop; Reval's trade and preserving staple.",
  "category": "trade_good",
  "handling": "fixed",
  "tags": [
    "salt",
    "trade",
    "pile"
  ],
  "physical": {
    "mass_kg": 300,
    "size_m": [
      1.38,
      0.48,
      0.97
    ],
    "materials": [
      "salt"
    ]
  },
  "actions": [
    "inspect"
  ],
  "economy": {
    "base_pfennigs": 500,
    "ownership": "merchant",
    "legality": "legal",
    "theft_severity": 0
  },
  "placement": {
    "mount": "floor",
    "spaces": [
      "warehouse",
      "market",
      "harbor"
    ],
    "grouping": "pile"
  },
  "model": {
    "status": "glb",
    "glb": "res://assets/props/crafts/salt_pile/salt_pile.glb",
    "prop_kind": "salt_pile",
    "measured_size_m": [
      1.38,
      0.48,
      0.97
    ]
  },
  "visual": {
    "preview": "docs/reports/images/object_catalog/obj.salt_pile.png",
    "icon": "res://assets/objects/icons/obj.salt_pile.png",
    "icon_status": "missing",
    "look": "Pile of grey-white coarse salt crystals beside an oak scoop.",
    "image_prompt": "Salt pile: Pile of grey-white coarse salt crystals beside an oak scoop."
  },
  "lifecycle": "usable",
  "confidence": "plausible composite",
  "uses": [
    "scoop salt"
  ]
}
