{
  "type": "world_object",
  "id": "obj.cup",
  "name": "Clay cup",
  "description": "A handled earthenware drinking cup.",
  "category": "household",
  "handling": "pocketable",
  "tags": [
    "kitchen",
    "tableware"
  ],
  "physical": {
    "mass_kg": 0.2,
    "size_m": [
      0.1,
      0.1,
      0.07
    ],
    "materials": [
      "clay_ceramic"
    ],
    "fragile": true
  },
  "actions": [
    "inspect",
    "take",
    "drop",
    "throw"
  ],
  "economy": {
    "base_pfennigs": 3,
    "ownership": "household",
    "legality": "legal",
    "theft_severity": 1
  },
  "placement": {
    "mount": "floor",
    "spaces": [
      "home_poor",
      "home_burgher",
      "tavern"
    ],
    "grouping": "single"
  },
  "model": {
    "status": "glb",
    "glb": "res://assets/props/domestic/kitchenware/medieval_kitchenware_kit.glb",
    "node": "KitchenwareCup",
    "prop_kind": "kitchenware",
    "variant": "kitchenware.cup",
    "measured_size_m": [
      0.1,
      0.1,
      0.07
    ]
  },
  "visual": {
    "preview": "docs/reports/images/object_catalog/obj.cup.png",
    "icon": "res://assets/objects/icons/obj.cup.png",
    "icon_status": "missing",
    "look": "Small brown clay cup with a single strap handle.",
    "image_prompt": "Clay cup: Small brown clay cup with a single strap handle."
  },
  "lifecycle": "usable",
  "confidence": "plausible composite",
  "carry": {
    "grid_width": 1,
    "grid_height": 1,
    "stackable": false
  },
  "throw": {
    "range_m": 3.5,
    "damage": 1,
    "breaks": true,
    "noise": "loud"
  }
}
