{
  "type": "world_object",
  "id": "obj.boat_timber_stack",
  "name": "Boat timber stack",
  "description": "A stack of curved oak ribs and planking seasoning for the boatyard.",
  "category": "material",
  "handling": "fixed",
  "tags": [
    "wood",
    "boatyard",
    "pile"
  ],
  "physical": {
    "mass_kg": 500,
    "size_m": [
      3.0,
      1.0,
      1.0
    ],
    "materials": [
      "wood"
    ],
    "flammable": true
  },
  "actions": [
    "inspect"
  ],
  "economy": {
    "base_pfennigs": 0,
    "ownership": "household",
    "legality": "legal",
    "theft_severity": 0
  },
  "placement": {
    "mount": "floor",
    "spaces": [
      "harbor"
    ],
    "grouping": "pile"
  },
  "model": {
    "status": "procedural",
    "prop_kind": "boat_timber_stack",
    "builder": "res://scripts/map/view3d/map_view_mesh_builder_district_life_props.gd"
  },
  "visual": {
    "preview": "docs/reports/images/object_catalog/obj.boat_timber_stack.png",
    "icon": "res://assets/objects/icons/obj.boat_timber_stack.png",
    "icon_status": "missing",
    "look": "Weathered oak planks and ribs stacked with spacers.",
    "image_prompt": "Boat timber stack: Weathered oak planks and ribs stacked with spacers."
  },
  "lifecycle": "usable",
  "confidence": "plausible composite"
}
