{
  "type": "world_object",
  "id": "obj.table_long_board",
  "name": "Long board table",
  "description": "A long tavern or hall board table set on trestles; seats a dozen.",
  "category": "furniture",
  "handling": "heavy",
  "tags": [
    "table",
    "surface",
    "tavern"
  ],
  "physical": {
    "mass_kg": 55,
    "size_m": [
      2.3,
      0.79,
      0.82
    ],
    "materials": [
      "wood"
    ],
    "flammable": true
  },
  "actions": [
    "inspect",
    "push",
    "pull"
  ],
  "economy": {
    "base_pfennigs": 150,
    "ownership": "household",
    "legality": "legal",
    "theft_severity": 2
  },
  "placement": {
    "mount": "floor",
    "spaces": [
      "tavern",
      "home_burgher",
      "church"
    ],
    "grouping": "single"
  },
  "model": {
    "status": "glb",
    "glb": "res://assets/props/furniture/tables/medieval_table_kit/medieval_table_kit.glb",
    "node": "LongBoardTable",
    "prop_kind": "table",
    "variant": "table.long_board",
    "measured_size_m": [
      2.3,
      0.79,
      0.82
    ]
  },
  "visual": {
    "preview": "docs/reports/images/object_catalog/obj.table_long_board.png",
    "icon": "res://assets/objects/icons/obj.table_long_board.png",
    "icon_status": "missing",
    "look": "Long rough-sawn oak board on trestles, ale rings and candle drips along its length.",
    "image_prompt": "Long board table: Long rough-sawn oak board on trestles, ale rings and candle drips along its length."
  },
  "lifecycle": "usable",
  "confidence": "plausible composite",
  "uses": [
    "place objects on top",
    "overturn as cover"
  ]
}
