{
  "type": "world_object",
  "id": "obj.firewood_stack",
  "name": "Firewood stack",
  "description": "A corded stack of split pine and birch logs.",
  "category": "material",
  "handling": "fixed",
  "tags": [
    "fuel",
    "pile",
    "wood"
  ],
  "physical": {
    "mass_kg": 220,
    "size_m": [
      2.07,
      0.55,
      0.92
    ],
    "materials": [
      "wood"
    ],
    "flammable": true
  },
  "actions": [
    "inspect"
  ],
  "economy": {
    "base_pfennigs": 30,
    "ownership": "household",
    "legality": "legal",
    "theft_severity": 0
  },
  "placement": {
    "mount": "floor",
    "spaces": [
      "home_poor",
      "home_burgher",
      "forge",
      "farm",
      "street"
    ],
    "grouping": "pile"
  },
  "model": {
    "status": "glb",
    "glb": "res://assets/props/crafts/yard_firewood_stack/yard_firewood_stack.glb",
    "prop_kind": "firewood_stack",
    "measured_size_m": [
      2.07,
      0.55,
      0.92
    ]
  },
  "visual": {
    "preview": "docs/reports/images/object_catalog/obj.firewood_stack.png",
    "icon": "res://assets/objects/icons/obj.firewood_stack.png",
    "icon_status": "missing",
    "look": "Neatly stacked split logs tied with hemp cord, birch bark on top.",
    "image_prompt": "Firewood stack: Neatly stacked split logs tied with hemp cord, birch bark on top."
  },
  "lifecycle": "usable",
  "confidence": "plausible composite",
  "composition": [
    {
      "id": "obj.firewood_log",
      "count": 24
    }
  ],
  "notes": "Individual logs (obj.firewood_log) are the takeable form."
}
